{
  "uhbs_version": "4.4.1",
  "target": {
    "name": "Trapster Community (Telnet :2323)",
    "class": "Low-Interaction",
    "profile_ref": "docs/conformance/labs/trapster/low_interaction_telnet_full.yaml"
  },
  "evaluated_at": "2026-07-27",
  "auditor": "UHBS-Lab detailed Docker run (trapster/telnet)",
  "modules": {
    "A": {
      "score": 100.0,
      "status": "PASSED",
      "weight": 0.3,
      "notes": "no gold_baseline_host in TPS \u2014 KS compare skipped (set performance_baseline.gold_baseline_host"
    },
    "B": {
      "score": 82.5,
      "status": "PASSED",
      "weight": 0.15,
      "notes": "survived binary blast"
    },
    "C": {
      "score": 55.0,
      "status": "PARTIAL",
      "weight": 0.25,
      "notes": "no STIX objects found"
    },
    "D": {
      "score": 90.0,
      "status": "PASSED",
      "notes": "UHBS_AIRGAP_ATTESTED=1 (operator attestation; not a substitute for shell probes"
    },
    "E": {
      "score": 100.0,
      "status": "PASSED",
      "weight": 0.1,
      "notes": "service alive after load (connect 0.1ms",
      "p50_ms": 3.69,
      "p95_ms": 9.64,
      "p99_ms": 13.39
    },
    "F": {
      "score": 70.0,
      "status": "PASSED",
      "weight": 0.2,
      "notes": "1 predictable PRNG seeds: trapster/modules/http.py"
    }
  },
  "weights": {
    "w_A": 0.3,
    "w_B": 0.15,
    "w_C": 0.25,
    "w_E": 0.1,
    "w_F": 0.2
  },
  "safety_gate": {
    "containment_score": 90.0,
    "delta_c": 0.81,
    "passed": false,
    "unauthorized_egress_leaks": 0
  },
  "uhqs": 64.9,
  "grade": "D",
  "notes": "Evaluation proof only. Graded Telnet :2323 on Trapster Community. Artifacts under docs/conformance/reports/trapster/telnet/."
}
